<?xml version="1.0" encoding="UTF-8"?>
<!-- edited with XMLSpy v2007 sp1 (http://www.altova.com) by Eric Forsyth (Naval Postgraduate School) -->
<!--W3C Schema generated by XMLSpy v2007 sp1 (http://www.altova.com)-->
<xs:schema xmlns:xs="http://www.w3.org/2001/XMLSchema">
	<xs:element name="terminals">
		<xs:complexType>
			<xs:sequence>
				<xs:element ref="t" maxOccurs="unbounded"/>
			</xs:sequence>
		</xs:complexType>
	</xs:element>
	<xs:element name="t">
		<xs:complexType>
			<xs:attribute name="word" type="xs:string" use="required"/>
			<xs:attribute name="pos" use="required">
				<xs:simpleType>
					<xs:restriction base="xs:string">
						<xs:enumeration value=""/>
						<xs:enumeration value="&apos;&apos;"/>
						<xs:enumeration value="("/>
						<xs:enumeration value=")"/>
						<xs:enumeration value=","/>
						<xs:enumeration value="."/>
						<xs:enumeration value=":"/>
						<xs:enumeration value="BES"/>
						<xs:enumeration value="CC"/>
						<xs:enumeration value="CD"/>
						<xs:enumeration value="DT"/>
						<xs:enumeration value="EX"/>
						<xs:enumeration value="FW"/>
						<xs:enumeration value="GW"/>
						<xs:enumeration value="IN"/>
						<xs:enumeration value="JJ"/>
						<xs:enumeration value="JJR"/>
						<xs:enumeration value="JJS"/>
						<xs:enumeration value="MD"/>
						<xs:enumeration value="NN"/>
						<xs:enumeration value="NNP"/>
						<xs:enumeration value="NNS"/>
						<xs:enumeration value="POS"/>
						<xs:enumeration value="PRP"/>
						<xs:enumeration value="PRP$"/>
						<xs:enumeration value="RB"/>
						<xs:enumeration value="RBR"/>
						<xs:enumeration value="RP"/>
						<xs:enumeration value="SYM"/>
						<xs:enumeration value="TO"/>
						<xs:enumeration value="UH"/>
						<xs:enumeration value="VB"/>
						<xs:enumeration value="VBD"/>
						<xs:enumeration value="VBG"/>
						<xs:enumeration value="VBN"/>
						<xs:enumeration value="VBP"/>
						<xs:enumeration value="VBZ"/>
						<xs:enumeration value="WDT"/>
						<xs:enumeration value="WP"/>
						<xs:enumeration value="WRB"/>
						<xs:enumeration value="^NN"/>
						<xs:enumeration value="``"/>
						<xs:enumeration value="HVS"/>
						<xs:enumeration value="^RB"/>
						<xs:enumeration value="^PRP$"/>
						<xs:enumeration value="^PRP^BES"/>
						<xs:enumeration value="^VBD"/>
						<xs:enumeration value="^VBG"/>
						<xs:enumeration value="^JJ"/>
						<xs:enumeration value="^UH"/>
						<xs:enumeration value="^PRP"/>
						<xs:enumeration value="^VBP"/>
						<xs:enumeration value="^WP^BES"/>
						<xs:enumeration value="^VB"/>
						<xs:enumeration value="^DT"/>
						<xs:enumeration value="^WP"/>
						<xs:enumeration value="^NNS"/>
						<xs:enumeration value="^IN"/>
						<xs:enumeration value="^PRP^VBP"/>
						<xs:enumeration value="^PRP^MD"/>
						<xs:enumeration value="^WRB^BES"/>
						<xs:enumeration value="^VB^PRP"/>
						<xs:enumeration value="^MD^RB"/>
						<xs:enumeration value="^VBP^RB"/>
						<xs:enumeration value="^VBP^RB^PRP"/>
						<xs:enumeration value="^MD"/>
						<xs:enumeration value="^VBP^UH"/>
						<xs:enumeration value="^VBP^PRP"/>
						<xs:enumeration value="^NNP"/>
						<xs:enumeration value="^NN^POS"/>
						<xs:enumeration value="^IN^DT"/>
						<xs:enumeration value="^CC"/>
						<xs:enumeration value="^VBP^DT"/>
						<xs:enumeration value="^TO^VB"/>
						<xs:enumeration value="RBS"/>
						<xs:enumeration value="X"/>
						<xs:enumeration value="^VBZ"/>
						<xs:enumeration value="^DT^NN"/>
						<xs:enumeration value="^VBN"/>
						<xs:enumeration value="NNPS"/>
						<xs:enumeration value="PDT"/>
						<xs:enumeration value="LS"/>
						<xs:enumeration value="#"/>
						<xs:enumeration value="WP$"/>
						<xs:enumeration value="$"/>
						<xs:enumeration value="^RB^PRP"/>
						<xs:enumeration value="^PRP^VBD"/>
						<xs:enumeration value="^UH^NNP"/>
						<xs:enumeration value="^JJ^NN"/>
						<xs:enumeration value="^NN^BES"/>
						<xs:enumeration value="^WRB"/>
						<xs:enumeration value="^RB^VBP"/>
						<xs:enumeration value="^TO"/>
						<xs:enumeration value="^RP"/>
						<xs:enumeration value="^JJS"/>
						<xs:enumeration value="^POS"/>
						<xs:enumeration value="^."/>
						<xs:enumeration value="^JJR"/>
					</xs:restriction>
				</xs:simpleType>
			</xs:attribute>
		</xs:complexType>
	</xs:element>
	<xs:element name="Session">
		<xs:complexType>
			<xs:sequence>
				<xs:element ref="Posts"/>
			</xs:sequence>
			<xs:attribute name="initialUserCount" type="xs:int" use="optional"/>
		</xs:complexType>
	</xs:element>
	<xs:element name="Posts">
		<xs:complexType>
			<xs:sequence>
				<xs:element ref="Post" maxOccurs="unbounded"/>
			</xs:sequence>
		</xs:complexType>
	</xs:element>
	<xs:element name="Post">
		<xs:complexType mixed="true">
			<xs:sequence>
				<xs:element ref="terminals"/>
			</xs:sequence>
			<xs:attribute name="user" type="xs:string" use="required"/>
			<xs:attribute name="class" use="required">
				<xs:simpleType>
					<xs:restriction base="xs:string">
						<xs:enumeration value="Accept"/>
						<xs:enumeration value="Bye"/>
						<xs:enumeration value="Clarify"/>
						<xs:enumeration value="Continuer"/>
						<xs:enumeration value="Emotion"/>
						<xs:enumeration value="Emphasis"/>
						<xs:enumeration value="Greet"/>
						<xs:enumeration value="Reject"/>
						<xs:enumeration value="Statement"/>
						<xs:enumeration value="System"/>
						<xs:enumeration value="nAnswer"/>
						<xs:enumeration value="whQuestion"/>
						<xs:enumeration value="yAnswer"/>
						<xs:enumeration value="ynQuestion"/>
						<xs:enumeration value="Other"/>
					</xs:restriction>
				</xs:simpleType>
			</xs:attribute>
		</xs:complexType>
	</xs:element>
</xs:schema>
